{
  "schema_version": 1,
  "character": {
    "id": "bronco",
    "name": "Bronco",
    "role": "Energetic athletic bronco",
    "tagline": null,
    "kind": "starter"
  },
  "sheet": {
    "status_line": "LAYOUT PROOF - placeholders only; LOGO_ASSET and most art MISSING / TO AUTHOR",
    "logo": {
      "path": null,
      "status": "MISSING / TO AUTHOR"
    }
  },
  "cast": {
    "k": 0.92,
    "k_status": "PROVISIONAL",
    "s0": 0.184
  },
  "palette": {
    "status": "PROVISIONAL",
    "mapping_note": "Names/hex from doc 09 s3 (code/ref values, not authority). Role mapping is a PROPOSAL pending production-plan step 9. Bronco: ACCENT = red star/gear (never maroon); slot 6 = BANDANA - MAROON (doc 16 s7). GEAR content open (step 9).",
    "slots": [
      {
        "label": "PRIMARY",
        "name": "Chestnut coat",
        "hex": "#B9672A",
        "status": "PROVISIONAL"
      },
      {
        "label": "SECONDARY",
        "name": "Mane",
        "hex": "#3A2314",
        "status": "PROVISIONAL"
      },
      {
        "label": "ACCENT",
        "name": "Red star / gear",
        "status": "PROVISIONAL"
      },
      {
        "status": "OPEN"
      },
      {
        "label": "DETAIL",
        "name": "Muzzle / blaze",
        "hex": "#E9B790",
        "status": "PROVISIONAL"
      },
      {
        "label": "BANDANA",
        "name": "Maroon",
        "hex": "#8E1B30",
        "status": "PROVISIONAL"
      }
    ]
  },
  "turnaround": {
    "front": {
      "path": null,
      "status": "MISSING / TO AUTHOR",
      "plan_status": "READY WITH CROP/MATTING",
      "transform_hint": "when authored: transform.ref_height_src_px (or units_per_source_px), optional ground_y_src"
    },
    "threeQuarter": {
      "path": null,
      "status": "MISSING / TO AUTHOR",
      "plan_status": "READY WITH CROP/MATTING",
      "transform_hint": "when authored: transform.ref_height_src_px (or units_per_source_px), optional ground_y_src"
    },
    "side": {
      "path": null,
      "status": "MISSING / TO AUTHOR",
      "plan_status": "READY WITH CROP/MATTING",
      "transform_hint": "when authored: transform.ref_height_src_px (or units_per_source_px), optional ground_y_src"
    },
    "back": {
      "path": null,
      "status": "MISSING / TO AUTHOR",
      "plan_status": "READY WITH CROP/MATTING",
      "transform_hint": "when authored: transform.ref_height_src_px (or units_per_source_px), optional ground_y_src"
    }
  },
  "hero": {
    "path": null,
    "status": "MISSING / TO AUTHOR",
    "plan_status": "READY WITH CROP/MATTING"
  },
  "head": {
    "path": null,
    "status": "MISSING / TO AUTHOR",
    "plan_status": "READY WITH CROP/MATTING"
  },
  "expressions": {
    "head_scale": 0.578,
    "head_scale_basis": "PROVISIONAL: matted bbox width of the first wired expression asset = nominal 100 px; replace once real matted heads exist",
    "idle": {
      "path": "idle-review-3/bronco_idle2.png",
      "sha256": "950796e5799ed3d02c4a330b45aa96fddcf7d70e5bc1c7f3725c883b57a777c0",
      "status": "PROVISIONAL",
      "plan_status": "MISSING / TO AUTHOR",
      "transform": {
        "units_per_source_px": 1.0,
        "eye_line_src_y": 65
      },
      "notes": "Existing transparent PNG wired for layout proof. No sign-off recorded, so it stays PROVISIONAL (doc 16 s2). eye_line_src_y is a manual visual estimate (+-3 src px)."
    },
    "happy": {
      "path": null,
      "status": "MISSING / TO AUTHOR",
      "plan_status": "READY WITH CROP/MATTING"
    },
    "thinking": {
      "path": null,
      "status": "MISSING / TO AUTHOR",
      "plan_status": "MISSING / TO AUTHOR"
    },
    "cheer": {
      "path": null,
      "status": "MISSING / TO AUTHOR",
      "plan_status": "READY WITH CROP/MATTING"
    },
    "discover": {
      "path": null,
      "status": "MISSING / TO AUTHOR",
      "plan_status": "PROVISIONAL"
    },
    "tryAgain": {
      "path": "try-again-review/bronco_tryagain.png",
      "sha256": "adef4525b708ad07016fec63bf5ab23950503ad87537dfb6dfc20e7fb84bcf54",
      "status": "PROVISIONAL",
      "plan_status": "PROVISIONAL",
      "transform": {
        "units_per_source_px": 1.0,
        "eye_line_src_y": 68
      },
      "notes": "Existing transparent PNG wired for layout proof. No sign-off recorded, so it stays PROVISIONAL (doc 16 s2). eye_line_src_y is a manual visual estimate (+-3 src px)."
    }
  },
  "details": [
    {
      "path": null,
      "status": "MISSING / TO AUTHOR",
      "plan_status": "READY WITH CROP/MATTING",
      "caption": "Cowboy hat (star badge)"
    },
    {
      "path": null,
      "status": "MISSING / TO AUTHOR",
      "plan_status": "READY WITH CROP/MATTING",
      "caption": "Maroon bandana"
    },
    {
      "path": null,
      "status": "MISSING / TO AUTHOR",
      "plan_status": "READY WITH CROP/MATTING",
      "caption": "Saddle & pack"
    },
    {
      "path": null,
      "status": "MISSING / TO AUTHOR",
      "plan_status": "READY WITH CROP/MATTING",
      "caption": "Star treatment"
    }
  ],
  "silhouettes": {
    "derive": true,
    "items": {}
  },
  "proportion": {
    "front_reference": "turnaround.front",
    "comparison": {
      "tag": "TAR",
      "k": 0.57
    }
  }
}
